{
  "schema_version": 1,
  "kind": "site.inspect",
  "data": {
    "site": "rec",
    "site_url": "http://localhost:8521",
    "site_name": "Dockerized_Moodle",
    "release": "5.2.3 (Build: 20260914)",
    "username": "student1",
    "user_id": "4",
    "can_upload": true,
    "can_download": true,
    "function_count": 429,
    "functions": []
  },
  "meta": {
    "site": null,
    "account": null,
    "source": "ws",
    "partial": false,
    "missing": [],
    "next_cursor": null
  }
}
